{
  "identity": {
    "name": "Aaron Benjamin",
    "headline_variants": [
      {
        "id": "headline-ux-designer",
        "text": "UX Designer",
        "length": "short",
        "audience": "either"
      },
      {
        "id": "headline-senior-ux-product-designer",
        "text": "Senior UX / Product Designer",
        "length": "short",
        "audience": "either"
      },
      {
        "id": "headline-ux-and-product-designer",
        "text": "UX & Product Designer",
        "length": "short",
        "audience": "either"
      }
    ],
    "emails": [
      {
        "id": "email-hello",
        "label": "current-site",
        "address": "hello@aaronbenjamin.design",
        "context": "src/assets/data/contact-info.yml line 7 (candidateEmail); archive/resume2/index.html line 14"
      },
      {
        "id": "email-gmail",
        "label": "archive-2017",
        "address": "abenjamin765@gmail.com",
        "context": "archive/resume/index.html line 320; archive/resume/print.html line 331"
      },
      {
        "id": "email-outlook",
        "label": "archive-2017-alternate",
        "address": "aaronbenjamin@outlook.com",
        "context": "archive/resume/index2.html line 30"
      }
    ],
    "phones": [
      {
        "id": "phone-main",
        "label": "current-site",
        "number": "(770) 380-5566"
      }
    ],
    "locations": [
      {
        "id": "location-powder-springs",
        "label": "current-site",
        "text": "Powder Springs, GA",
        "sources": [
          {
            "path": "src/assets/data/contact-info.yml",
            "locator": "line 9: candidateLocation: \"Powder Springs, GA\""
          }
        ]
      },
      {
        "id": "location-seattle",
        "label": "archive-2017",
        "text": "Seattle",
        "sources": [
          {
            "path": "archive/resume/index.html",
            "locator": "line 358: \"Seattle based UX designer.\""
          },
          {
            "path": "archive/resume/print.html",
            "locator": "line 334: \"Seattle based UX designer.\""
          }
        ]
      }
    ],
    "website": "aaronbenjamin.design",
    "linkedin": "https://www.linkedin.com/in/aaronbenjamindesign/",
    "summary_variants": [
      {
        "id": "summary-ten-years",
        "text": "For more than 10 years, I've helped global brands design and build products that deliver long-term value to customers and achieve business goals.",
        "length": "short",
        "audience": "either"
      },
      {
        "id": "summary-resume-page",
        "text": "I lead design for complex product systems, connecting research, shared models, and shipped interfaces. My work spans marketplaces, education, commerce, and internal tools, with a focus on decisions teams can carry through implementation.",
        "length": "medium",
        "audience": "human"
      },
      {
        "id": "summary-resume-meta",
        "text": "Aaron Benjamin is a product designer who leads complex UX work across marketplaces, education, commerce, and internal tools.",
        "length": "short",
        "audience": "either"
      },
      {
        "id": "summary-seattle-seven-years",
        "text": "Seattle based UX designer. More than 7 years of experience creating products for customers around the world at companies including AT&T, HP, and Amazon. Skilled at visualizing complex, technical concepts as concrete mockups and prototypes. Exceptional design leadership skills. Able to lead broad-ranging initiatives and projects. Excels at translating customer and business needs into solutions with long-term value.",
        "length": "long",
        "audience": "human"
      }
    ]
  },
  "experience": [
    {
      "id": "role-renaissance-learning-senior-ux-designer",
      "company": "Renaissance Learning",
      "title": "Senior UX Designer",
      "title_variants": [
        {
          "id": "renaissance-title-current-site",
          "title": "Senior UX Designer",
          "label": "current-site",
          "sources": [
            {
              "path": "src/assets/data/work-history.yml",
              "locator": "line 2"
            }
          ]
        }
      ],
      "employment_type": "full-time",
      "location": "Remote",
      "workplace": "remote",
      "start": "2024-07",
      "end": null,
      "current": true,
      "area": "Renaissance Intelligence",
      "claims": [
        {
          "id": "claim-renaissance-ux-strategy",
          "kind": "strategy",
          "text": "Led UX strategy and end-to-end design for K-12 classroom experiences across Renaissance Intelligence.",
          "status": "unverified",
          "emphasis": [
            "current-site",
            "leadership",
            "education"
          ],
          "sources": [
            {
              "path": "src/assets/data/work-history.yml",
              "locator": "line 8"
            }
          ]
        },
        {
          "id": "claim-renaissance-intelligence-launch",
          "kind": "craft",
          "text": "Directed the design and launch of Renaissance Intelligence and contributed reusable patterns to the design system.",
          "status": "unverified",
          "emphasis": [
            "current-site",
            "design-systems"
          ],
          "sources": [
            {
              "path": "src/assets/data/work-history.yml",
              "locator": "line 9"
            }
          ]
        },
        {
          "id": "claim-renaissance-ai-prototyping",
          "kind": "method",
          "text": "Designed AI-assisted teacher experiences and used AI-assisted prototyping to speed up design iteration and testing.",
          "status": "unverified",
          "emphasis": [
            "current-site",
            "ai"
          ],
          "sources": [
            {
              "path": "src/assets/data/work-history.yml",
              "locator": "line 10"
            }
          ]
        },
        {
          "id": "claim-renaissance-ooux",
          "kind": "method",
          "text": "Championed Object-Oriented UX across design and engineering to strengthen shared product models and team alignment.",
          "status": "unverified",
          "emphasis": [
            "current-site",
            "ooux"
          ],
          "sources": [
            {
              "path": "src/assets/data/work-history.yml",
              "locator": "line 11"
            }
          ]
        }
      ]
    },
    {
      "id": "role-indeed-senior-ux-designer",
      "company": "Indeed",
      "title": "Senior UX Designer",
      "title_variants": [
        {
          "id": "indeed-title-current-site",
          "title": "Senior UX Designer",
          "label": "current-site-and-archive-resume2",
          "sources": [
            {
              "path": "src/assets/data/work-history.yml",
              "locator": "line 13"
            },
            {
              "path": "archive/resume2/index.html",
              "locator": "line 51: \"Senior UX Designer at Indeed, Remote\""
            }
          ]
        }
      ],
      "employment_type": "full-time",
      "location": "Remote",
      "workplace": "remote",
      "start": "2022-10",
      "end": "2024-07",
      "summaries": {
        "one_line": {
          "id": "claim-indeed-summary-one-line",
          "kind": "summary",
          "text": "Ownership of monetization and growth employer experience focused on driving revenue",
          "status": "unverified",
          "sources": [
            {
              "path": "archive/resume2/index.html",
              "locator": "line 56"
            }
          ]
        }
      },
      "claims": [
        {
          "id": "claim-indeed-refresh-delivery",
          "kind": "craft",
          "text": "Designed Job Refresh, owning information architecture, interaction design, messaging, prototypes, and stakeholder alignment; it became part of Sponsored Jobs after six months of free availability.",
          "status": "unverified",
          "sources": [
            {
              "path": "https://docs.google.com/document/d/1vgy_c0gTg9EC0mgCxsc8YRGNYOjpj1Ol/edit",
              "locator": "Aaron's direct account, September 30, 2026; Delivered feature Job Refresh"
            }
          ]
        },
        {
          "id": "claim-indeed-refresh-feedback",
          "kind": "impact",
          "text": "Addressed employers’ closing-and-reposting workaround with a flow requiring substantially updated job information; employers reported less time and effort than reposting.",
          "status": "unverified",
          "sources": [
            {
              "path": "https://docs.google.com/document/d/1vgy_c0gTg9EC0mgCxsc8YRGNYOjpj1Ol/edit",
              "locator": "Candidate-confirmed qualitative employer feedback; no quantified savings"
            }
          ]
        },
        {
          "id": "claim-indeed-monetization-growth",
          "kind": "impact",
          "text": "Led monetization and growth design initiatives for the employer experience, contributing directly to revenue expansion.",
          "status": "unverified",
          "emphasis": [
            "current-site",
            "monetization",
            "growth"
          ],
          "sources": [
            {
              "path": "src/assets/data/work-history.yml",
              "locator": "line 19"
            }
          ]
        },
        {
          "id": "claim-indeed-marketplace-strategy",
          "kind": "strategy",
          "text": "Partnered with leadership to shape and execute the companys marketplace monetization strategy.",
          "status": "unverified",
          "emphasis": [
            "current-site",
            "monetization",
            "strategy"
          ],
          "sources": [
            {
              "path": "src/assets/data/work-history.yml",